********
UC1:-Ability to create a Address Book Service DB
********

mysql> CREATE DATABASE addressbook_service;
Query OK, 1 row affected (0.22 sec)

mysql> ^C
mysql> show databases;
+---------------------+
| Database            |
+---------------------+
| addressbook_service |
| information_schema  |
| mysql               |
| payroll_service     |
| performance_schema  |
| pets                |
| sys                 |
| testdb              |
+---------------------+
8 rows in set (0.07 sec)

*******
UC2:-Ability to create a Address Book Table with first and last names, address, city, state, zip, phone number and email as its attributes
*******

mysql> USE addressbook_service;
Database changed

mysql> SELECT DATABASE();
+---------------------+
| DATABASE()          |
+---------------------+
| addressbook_service |
+---------------------+
1 row in set (0.00 sec)

mysql> CREATE TABLE addressbook_service
    -> (
    -> id      INT unsigned NOT NULL AUTO_INCREMENT,
    -> FirstName     VARCHAR(150)  NOT NULL,
    -> LastName      VARCHAR(150)  NOT NULL,
    -> Address       VARCHAR(150)  NOT NULL,
    -> City          VARCHAR(150)  NOT NULL,
    -> State         VARCHAR(150)  NOT NULL,
    -> Zip           DOUBLE NOT NULL,
    -> PhoneNumber   DOUBLE NOT NULL,
    -> Email         VARCHAR(150)  NOT NULL,
    -> PRIMARY KEY   (id)
    -> );
Query OK, 0 rows affected (1.43 sec)

mysql> DESCRIBE addressbook_service;
+-------------+--------------+------+-----+---------+----------------+
| Field       | Type         | Null | Key | Default | Extra          |
+-------------+--------------+------+-----+---------+----------------+
| id          | int unsigned | NO   | PRI | NULL    | auto_increment |
| FirstName   | varchar(150) | NO   |     | NULL    |                |
| LastName    | varchar(150) | NO   |     | NULL    |                |
| Address     | varchar(150) | NO   |     | NULL    |                |
| City        | varchar(150) | NO   |     | NULL    |                |
| State       | varchar(150) | NO   |     | NULL    |                |
| Zip         | double       | NO   |     | NULL    |                |
| PhoneNumber | double       | NO   |     | NULL    |                |
| Email       | varchar(150) | NO   |     | NULL    |                |
+-------------+--------------+------+-----+---------+----------------+
9 rows in set (0.04 sec)

********
UC3:-Ability to insert new Contacts to Address Book
********

mysql> INSERT INTO  addressbook_service (FirstName,LastName,Address,City,State,Z
ip,PhoneNumber,Email) VALUES
    -> ('Omkar', 'Papal', 'Hadapsar', 'Pune', 'Maharashtra', '412308', '77095471
62', 'omipapal12@gmail.com');
Query OK, 1 row affected (0.13 sec)

mysql> SELECT * FROM addressbook_service;
+----+-----------+----------+----------+------+-------------+--------+-------------+----------------------+
| id | FirstName | LastName | Address  | City | State       | Zip    | PhoneNumber | Email                |
+----+-----------+----------+----------+------+-------------+--------+-------------+----------------------+
|  1 | Omkar     | Papal    | Hadapsar | Pune | Maharashtra | 412308 |  7709547162 | omipapal12@gmail.com |
+----+-----------+----------+----------+------+-------------+--------+-------------+----------------------+
1 row in set (0.07 sec)

mysql> INSERT INTO  addressbook_service (FirstName,LastName,Address,City,State,Zip,PhoneNumber,Email) VALUES
    -> ('Vikas', 'Papal', 'Hadapsar', 'Pune', 'Maharashtra', '412308', '7704567802', 'vtpapal12@gmail.com');
Query OK, 1 row affected (0.18 sec)

mysql> SELECT * FROM addressbook_service;
+----+-----------+----------+----------+------+-------------+--------+-------------+----------------------+
| id | FirstName | LastName | Address  | City | State       | Zip    | PhoneNumber | Email                |
+----+-----------+----------+----------+------+-------------+--------+-------------+----------------------+
|  1 | Omkar     | Papal    | Hadapsar | Pune | Maharashtra | 412308 |  7709547162 | omipapal12@gmail.com |
|  2 | Vikas     | Papal    | Hadapsar | Pune | Maharashtra | 412308 |  7704567802 | vtpapal12@gmail.com  |
+----+-----------+----------+----------+------+-------------+--------+-------------+----------------------+
2 rows in set (0.00 sec)

********
UC4:- Ability to edit existing contact person using their name
********

mysql> update addressbook_service set state = 'Nashik' where FirstName = 'Omkar';
Query OK, 1 row affected (0.12 sec)
Rows matched: 1  Changed: 1  Warnings: 0

mysql> SELECT * FROM addressbook_service;
+----+-----------+----------+----------+------+-------------+--------+-------------+----------------------+
| id | FirstName | LastName | Address  | City | State       | Zip    | PhoneNumber | Email                |
+----+-----------+----------+----------+------+-------------+--------+-------------+----------------------+
|  1 | Omkar     | Papal    | Hadapsar | Pune | Nashik      | 412308 |  7709547162 | omipapal12@gmail.com |
|  2 | Vikas     | Papal    | Hadapsar | Pune | Maharashtra | 412308 |  7704567802 | vtpapal12@gmail.com  |
+----+-----------+----------+----------+------+-------------+--------+-------------+----------------------+
2 rows in set (0.01 sec)

********
UC5:- Ability to delete a person using person's name
********

mysql> DELETE FROM addressbook_service where FirstName = 'Omkar';
Query OK, 1 row affected (0.18 sec)

mysql> SELECT * FROM addressbook_service;
+----+-----------+----------+----------+------+-------------+--------+-------------+---------------------+
| id | FirstName | LastName | Address  | City | State       | Zip    | PhoneNumber | Email               |
+----+-----------+----------+----------+------+-------------+--------+-------------+---------------------+
|  2 | Vikas     | Papal    | Hadapsar | Pune | Maharashtra | 412308 |  7704567802 | vtpapal12@gmail.com |
+----+-----------+----------+----------+------+-------------+--------+-------------+---------------------+
1 row in set (0.14 sec)

*******
UC6:- Ability to Retrieve Person belonging to a City or State from the Address Book
*******

mysql> SELECT City FROM addressbook_service WHERE FirstName = 'Vikas';
+------+
| City |
+------+
| Pune |
+------+
1 row in set (0.00 sec)

mysql> SELECT State FROM addressbook_service WHERE FirstName = 'Vikas';
+-------------+
| State       |
+-------------+
| Maharashtra |
+-------------+
1 row in set (0.00 sec)

********
UC7:- Ability to understand the size of address book by City and State
********

mysql> SELECT State, COUNT(FirstName) FROM addressbook_service WHERE State = 'Maharashtra';
+-------------+------------------+
| State       | COUNT(FirstName) |
+-------------+------------------+
| Maharashtra |                2 |
+-------------+------------------+
1 row in set (0.05 sec)

mysql> SELECT City, COUNT(FirstName) FROM addressbook_service WHERE City = 'Pune';
+------+------------------+
| City | COUNT(FirstName) |
+------+------------------+
| Pune |                2 |
+------+------------------+
1 row in set (0.00 sec)

********
UC8:- Ability to retrieve entries sorted alphabetically by Person’s name for a given city
********

mysql> SELECT FirstName,LastName,Address,City,State,Zip,PhoneNumber,Email FROM addressbook_service ORDER BY FirstName;
+-----------+----------+----------+------+-------------+--------+-------------+----------------------+
| FirstName | LastName | Address  | City | State       | Zip    | PhoneNumber | Email                |
+-----------+----------+----------+------+-------------+--------+-------------+----------------------+
| Omkar     | Papal    | Hadapsar | Pune | Maharashtra | 412308 |  7709547162 | omipapal12@gmail.com |
| Vikas     | Papal    | Hadapsar | Pune | Maharashtra | 412308 |  7704567802 | vtpapal12@gmail.com  |
+-----------+----------+----------+------+-------------+--------+-------------+----------------------+
2 rows in set (0.06 sec)

mysql> SELECT FirstName,LastName,Address,City,State,Zip,PhoneNumber,Email FROM addressbook_service ORDER BY LastName;
+-----------+----------+----------+------+-------------+--------+-------------+----------------------+
| FirstName | LastName | Address  | City | State       | Zip    | PhoneNumber | Email                |
+-----------+----------+----------+------+-------------+--------+-------------+----------------------+
| Vikas     | Papal    | Hadapsar | Pune | Maharashtra | 412308 |  7704567802 | vtpapal12@gmail.com  |
| Omkar     | Papal    | Hadapsar | Pune | Maharashtra | 412308 |  7709547162 | omipapal12@gmail.com |
+-----------+----------+----------+------+-------------+--------+-------------+----------------------+
2 rows in set (0.00 sec)
